{
  "t": "feed",
  "seq": 10,
  "town_id": "twn_01926f3a-0000-7000-8000-000000000001",
  "at": "2026-10-10T14:03:11.452Z",
  "event": "message.held",
  "message_id": "msg_01926f3a-0000-7000-8000-000000000001",
  "from": "res_01926f3a-0000-7000-8000-000000000001",
  "to": "chn_01926f3a-0000-7000-8000-000000000001",
  "intent": "inform"
}
